{
  "schema_version": "1.0",
  "replay_id": "example-replay-001",
  "created_at": "2026-09-21T15:00:00Z",
  "tick_rate": 60,
  "simulation_version": "EXAMPLE-SIM",
  "moveset_version": "EXAMPLE-MOVES",
  "model_version": "EXAMPLE-MODEL",
  "roster_snapshot": "2026-09-21",
  "arena_id": "summit_example",
  "player_avatar_id": "anonymous_a",
  "opponent_avatar_id": "anonymous_b",
  "seed": 14321,
  "asset_manifest_sha256": "0000000000000000000000000000000000000000000000000000000000000000",
  "initial_state_file": "example-initial-state.json",
  "input_events_file": "example-inputs.jsonl",
  "applied_decisions_file": "example-decisions.jsonl",
  "snapshots_file": "example-snapshots.jsonl",
  "snapshot_interval_ticks": 120,
  "controller_mode": "human_vs_laya",
  "verified_competitive_result": false,
  "fiction_notice": "Fictional arcade satire. No endorsement implied.",
  "illustrative_example": true
}